{
  "objetivo": "Preserve the legacy CAF checkpoint contract.",
  "estado": "EM_EXECUCAO",
  "ultimo_sucesso": "Baseline verified.",
  "falha_atual": "nenhuma",
  "classe_da_falha": "NENHUMA",
  "efeito_confirmado": "No failure effect.",
  "recuperacao_escolhida": "nenhuma",
  "proxima_acao": "Validate legacy compatibility.",
  "destinatario": "MESTRE",
  "artefatos": [
    {
      "tipo": "commit",
      "referencia": "b91823a947715e09d69c72999e2278523f2259be"
    }
  ]
}
